{
  "schema": "amiss/organization-floor",
  "floor_id": "platform/scanner-floor-2026-07",
  "repository": {
    "host": "gitlab.com",
    "owner": "platform/security",
    "name": "spec-to-rest"
  },
  "ref": "refs/heads/main",
  "minimum_profile": "enforce",
  "minimum_dispositions": [
    { "finding_kind": "explicit-target-missing", "disposition": "fail" }
  ],
  "protected_inventory": [
    "README.md"
  ],
  "protected_control_paths": [
    ".amiss/scanner-policy.json"
  ],
  "waivable_finding_kinds": [
    "explicit-target-missing"
  ],
  "authorized_debt_owners": [
    "team:docs-platform"
  ],
  "authorized_waiver_issuers": [
    "team:release-engineering"
  ],
  "resource_limits": [
    { "resource": "machine-json-bytes", "maximum": 268435456 },
    { "resource": "typed-analysis-errors-retained", "maximum": 64 }
  ]
}
